[
  {
    "source_id": "warden-shield-wall",
    "source_type": "ability",
    "phases": ["shooting", "fight"],
    "game_version": { "edition": "10th", "dataslate": "2025-q3" },
    "authored_by": "40kdc-community"
  },
  {
    "source_id": "void-harvest-aura",
    "source_type": "ability",
    "phases": ["command", "fight"],
    "game_version": { "edition": "10th", "dataslate": "2025-q3" },
    "authored_by": "40kdc-community"
  },
  {
    "source_id": "ironclad-advance",
    "source_type": "stratagem",
    "phases": ["movement"],
    "game_version": { "edition": "10th", "dataslate": "2025-q3" },
    "authored_by": "40kdc-community"
  }
]
